{
  "id": "aurora_e4",
  "display_name_key": "SHIP_AURORA_E4",
  "description_key": "SHIP_AURORA_E4_DESC",
  "role_key": "SHIP_ROLE_EXTREME_ENVIRONMENTS",
  "unlock": {
    "rank": "deep_space_operator",
    "price": 6200
  },
  "base_stats": {
    "max_speed": 300,
    "acceleration": 410,
    "dry_mass": 13,
    "cargo_inertia_factor": 0.29,
    "turn_response": 5.9,
    "boost_acceleration": 220,
    "boost_duration": 0.65,
    "boost_recharge_seconds": 3.1,
    "boost_turn_authority": 0.79,
    "scan_range": 355,
    "capture_distance": 62,
    "pull_speed": 560,
    "collection_speed_multiplier": 1.02,
    "cargo_capacity": 11,
    "boost_recharge_rate": 1.04,
    "boost_duration_bonus": 0.02,
    "boost_charge_capacity": 1,
    "environment_force_response": 0.48,
    "environment_drag_response": 0.55
  },
  "upgrade_profile": "standard",
  "module_slots": {
    "propulsion": 1,
    "recovery": 1,
    "cargo": 1,
    "utility": 1
  },
  "default_modules": {
    "propulsion": [
      "balanced_drive"
    ],
    "recovery": [
      "standard_recovery"
    ],
    "cargo": [
      "standard_cargo"
    ],
    "utility": [
      "standard_utility"
    ]
  },
  "visual": {
    "base_texture": "res://assets/original/ships/aurora_e4/base.webp",
    "render_scale": 0.082,
    "paint_mode": "rgb_mask",
    "paint_mask": "res://assets/original/ships/aurora_e4/paint_mask.png",
    "details_texture": "",
    "emissive_texture": "",
    "engine_sockets": [
      {
        "id": "engine_1",
        "position": [
          -13.1,
          34.3
        ]
      },
      {
        "id": "engine_2",
        "position": [
          0.1,
          35.5
        ]
      },
      {
        "id": "engine_3",
        "position": [
          13.1,
          34.3
        ]
      }
    ],
    "tractor_socket": [
      0,
      -27
    ],
    "collision_mode": "base_alpha"
  }
}
