{
  "id": "pioneer_01",
  "display_name_key": "SHIP_PIONEER_01",
  "description_key": "SHIP_PIONEER_01_DESC",
  "role_key": "SHIP_ROLE_GENERALIST",
  "unlock": {
    "rank": "trainee",
    "price": 0
  },
  "base_stats": {
    "max_speed": 300,
    "acceleration": 420,
    "dry_mass": 12,
    "cargo_inertia_factor": 0.35,
    "turn_response": 6,
    "boost_acceleration": 220,
    "boost_duration": 0.62,
    "boost_recharge_seconds": 3.2,
    "boost_turn_authority": 0.78,
    "scan_range": 320,
    "capture_distance": 58,
    "pull_speed": 520,
    "collection_speed_multiplier": 1,
    "cargo_capacity": 12,
    "boost_recharge_rate": 1,
    "boost_duration_bonus": 0,
    "boost_charge_capacity": 1,
    "environment_force_response": 1,
    "environment_drag_response": 1
  },
  "upgrade_profile": "standard",
  "module_slots": {
    "propulsion": 1,
    "recovery": 1,
    "cargo": 1,
    "utility": 1
  },
  "default_modules": {
    "propulsion": [
      "balanced_drive"
    ],
    "recovery": [
      "standard_recovery"
    ],
    "cargo": [
      "standard_cargo"
    ],
    "utility": [
      "standard_utility"
    ]
  },
  "visual": {
    "base_texture": "res://assets/original/ships/pioneer_01/base.webp",
    "render_scale": 0.085,
    "paint_mode": "rgb_mask",
    "paint_mask": "res://assets/original/ships/pioneer_01/paint_mask.png",
    "details_texture": "",
    "emissive_texture": "",
    "engine_sockets": [
      {
        "id": "engine_1",
        "position": [
          -16.1,
          36.4
        ]
      },
      {
        "id": "engine_2",
        "position": [
          -0.2,
          36.9
        ]
      },
      {
        "id": "engine_3",
        "position": [
          15.8,
          36.5
        ]
      }
    ],
    "tractor_socket": [
      0,
      -27
    ],
    "collision_mode": "base_alpha"
  }
}
