{
  "id": "pulse_v2",
  "display_name_key": "SHIP_PULSE_V2",
  "description_key": "SHIP_PULSE_V2_DESC",
  "role_key": "SHIP_ROLE_BOOST",
  "unlock": {
    "rank": "orbital_cleaner",
    "price": 2300
  },
  "base_stats": {
    "max_speed": 325,
    "acceleration": 450,
    "dry_mass": 10.5,
    "cargo_inertia_factor": 0.36,
    "turn_response": 6.5,
    "boost_acceleration": 320,
    "boost_duration": 0.76,
    "boost_recharge_seconds": 2.55,
    "boost_turn_authority": 0.84,
    "scan_range": 275,
    "capture_distance": 54,
    "pull_speed": 500,
    "collection_speed_multiplier": 0.92,
    "cargo_capacity": 10,
    "boost_recharge_rate": 1.25,
    "boost_duration_bonus": 0.04,
    "boost_charge_capacity": 1,
    "environment_force_response": 1.02,
    "environment_drag_response": 0.96
  },
  "upgrade_profile": "standard",
  "module_slots": {
    "propulsion": 1,
    "recovery": 1,
    "cargo": 1,
    "utility": 1
  },
  "default_modules": {
    "propulsion": [
      "balanced_drive"
    ],
    "recovery": [
      "standard_recovery"
    ],
    "cargo": [
      "standard_cargo"
    ],
    "utility": [
      "standard_utility"
    ]
  },
  "visual": {
    "base_texture": "res://assets/original/ships/pulse_v2/base.webp",
    "render_scale": 0.074,
    "paint_mode": "rgb_mask",
    "paint_mask": "res://assets/original/ships/pulse_v2/paint_mask.png",
    "details_texture": "",
    "emissive_texture": "",
    "engine_sockets": [
      {
        "id": "engine_1",
        "position": [
          -10.1,
          28.2
        ]
      },
      {
        "id": "engine_2",
        "position": [
          0,
          29.6
        ]
      },
      {
        "id": "engine_3",
        "position": [
          10,
          28
        ]
      }
    ],
    "tractor_socket": [
      0,
      -27
    ],
    "collision_mode": "base_alpha"
  }
}
