{
  "id": "comet_x4",
  "display_name_key": "SHIP_COMET_X4",
  "description_key": "SHIP_COMET_X4_DESC",
  "role_key": "SHIP_ROLE_SPEED_BOOST",
  "unlock": {
    "rank": "sector_specialist",
    "price": 4200
  },
  "base_stats": {
    "max_speed": 410,
    "acceleration": 505,
    "dry_mass": 9,
    "cargo_inertia_factor": 0.43,
    "turn_response": 6.8,
    "boost_acceleration": 355,
    "boost_duration": 0.78,
    "boost_recharge_seconds": 2.45,
    "boost_turn_authority": 0.86,
    "scan_range": 260,
    "capture_distance": 50,
    "pull_speed": 480,
    "collection_speed_multiplier": 0.86,
    "cargo_capacity": 8,
    "boost_recharge_rate": 1.3,
    "boost_duration_bonus": 0.05,
    "boost_charge_capacity": 1,
    "environment_force_response": 1.05,
    "environment_drag_response": 0.9
  },
  "upgrade_profile": "standard",
  "module_slots": {
    "propulsion": 1,
    "recovery": 1,
    "cargo": 1,
    "utility": 1
  },
  "default_modules": {
    "propulsion": [
      "balanced_drive"
    ],
    "recovery": [
      "standard_recovery"
    ],
    "cargo": [
      "standard_cargo"
    ],
    "utility": [
      "standard_utility"
    ]
  },
  "visual": {
    "base_texture": "res://assets/original/ships/comet_x4/base.webp",
    "render_scale": 0.07,
    "paint_mode": "rgb_mask",
    "paint_mask": "res://assets/original/ships/comet_x4/paint_mask.png",
    "details_texture": "",
    "emissive_texture": "",
    "engine_sockets": [
      {
        "id": "engine_1",
        "position": [
          -8.8,
          29
        ]
      },
      {
        "id": "engine_2",
        "position": [
          0,
          30.1
        ]
      },
      {
        "id": "engine_3",
        "position": [
          8.6,
          29
        ]
      }
    ],
    "tractor_socket": [
      0,
      -27
    ],
    "collision_mode": "base_alpha"
  }
}
