{
  "id": "kestrel_s2",
  "display_name_key": "SHIP_KESTREL_S2",
  "description_key": "SHIP_KESTREL_S2_DESC",
  "role_key": "SHIP_ROLE_CRUISE",
  "unlock": {
    "rank": "orbital_cleaner",
    "price": 2150
  },
  "base_stats": {
    "max_speed": 385,
    "acceleration": 470,
    "dry_mass": 9.5,
    "cargo_inertia_factor": 0.4,
    "turn_response": 6.4,
    "boost_acceleration": 260,
    "boost_duration": 0.61,
    "boost_recharge_seconds": 2.9,
    "boost_turn_authority": 0.82,
    "scan_range": 285,
    "capture_distance": 52,
    "pull_speed": 490,
    "collection_speed_multiplier": 0.9,
    "cargo_capacity": 9,
    "boost_recharge_rate": 1.08,
    "boost_duration_bonus": 0,
    "boost_charge_capacity": 1,
    "environment_force_response": 1.02,
    "environment_drag_response": 0.94
  },
  "upgrade_profile": "standard",
  "module_slots": {
    "propulsion": 1,
    "recovery": 1,
    "cargo": 1,
    "utility": 1
  },
  "default_modules": {
    "propulsion": [
      "balanced_drive"
    ],
    "recovery": [
      "standard_recovery"
    ],
    "cargo": [
      "standard_cargo"
    ],
    "utility": [
      "standard_utility"
    ]
  },
  "visual": {
    "base_texture": "res://assets/original/ships/kestrel_s2/base.webp",
    "render_scale": 0.073,
    "paint_mode": "rgb_mask",
    "paint_mask": "res://assets/original/ships/kestrel_s2/paint_mask.png",
    "details_texture": "",
    "emissive_texture": "",
    "engine_sockets": [
      {
        "id": "engine_1",
        "position": [
          -6.8,
          31.2
        ]
      },
      {
        "id": "engine_2",
        "position": [
          6.7,
          31.2
        ]
      }
    ],
    "tractor_socket": [
      0,
      -27
    ],
    "collision_mode": "base_alpha"
  }
}
