{
  "id": "swiftlet_s1",
  "display_name_key": "SHIP_SWIFTLET_S1",
  "description_key": "SHIP_SWIFTLET_S1_DESC",
  "role_key": "SHIP_ROLE_AGILITY",
  "unlock": {
    "rank": "trainee",
    "price": 900
  },
  "base_stats": {
    "max_speed": 335,
    "acceleration": 525,
    "dry_mass": 8.5,
    "cargo_inertia_factor": 0.38,
    "turn_response": 7.4,
    "boost_acceleration": 250,
    "boost_duration": 0.6,
    "boost_recharge_seconds": 3,
    "boost_turn_authority": 0.88,
    "scan_range": 300,
    "capture_distance": 54,
    "pull_speed": 500,
    "collection_speed_multiplier": 0.95,
    "cargo_capacity": 9,
    "boost_recharge_rate": 1.08,
    "boost_duration_bonus": 0,
    "boost_charge_capacity": 1,
    "environment_force_response": 1.05,
    "environment_drag_response": 1
  },
  "upgrade_profile": "standard",
  "module_slots": {
    "propulsion": 1,
    "recovery": 1,
    "cargo": 1,
    "utility": 1
  },
  "default_modules": {
    "propulsion": [
      "balanced_drive"
    ],
    "recovery": [
      "standard_recovery"
    ],
    "cargo": [
      "standard_cargo"
    ],
    "utility": [
      "standard_utility"
    ]
  },
  "visual": {
    "base_texture": "res://assets/original/ships/swiftlet_s1/base.webp",
    "render_scale": 0.072,
    "paint_mode": "rgb_mask",
    "paint_mask": "res://assets/original/ships/swiftlet_s1/paint_mask.png",
    "details_texture": "",
    "emissive_texture": "",
    "engine_sockets": [
      {
        "id": "engine_1",
        "position": [
          -13.3,
          30.8
        ]
      },
      {
        "id": "engine_2",
        "position": [
          0,
          31.2
        ]
      },
      {
        "id": "engine_3",
        "position": [
          13.3,
          30.8
        ]
      }
    ],
    "tractor_socket": [
      0,
      -27
    ],
    "collision_mode": "base_alpha"
  }
}
