{
  "id": "manta_t1",
  "display_name_key": "SHIP_MANTA_T1",
  "description_key": "SHIP_MANTA_T1_DESC",
  "role_key": "SHIP_ROLE_SCANNER",
  "unlock": {
    "rank": "junior_cleaner",
    "price": 1250
  },
  "base_stats": {
    "max_speed": 285,
    "acceleration": 400,
    "dry_mass": 12.5,
    "cargo_inertia_factor": 0.34,
    "turn_response": 5.8,
    "boost_acceleration": 210,
    "boost_duration": 0.62,
    "boost_recharge_seconds": 3.3,
    "boost_turn_authority": 0.76,
    "scan_range": 440,
    "capture_distance": 64,
    "pull_speed": 540,
    "collection_speed_multiplier": 1,
    "cargo_capacity": 11,
    "boost_recharge_rate": 0.96,
    "boost_duration_bonus": 0,
    "boost_charge_capacity": 1,
    "environment_force_response": 0.98,
    "environment_drag_response": 0.96
  },
  "upgrade_profile": "standard",
  "module_slots": {
    "propulsion": 1,
    "recovery": 1,
    "cargo": 1,
    "utility": 1
  },
  "default_modules": {
    "propulsion": [
      "balanced_drive"
    ],
    "recovery": [
      "standard_recovery"
    ],
    "cargo": [
      "standard_cargo"
    ],
    "utility": [
      "standard_utility"
    ]
  },
  "visual": {
    "base_texture": "res://assets/original/ships/manta_t1/base.webp",
    "render_scale": 0.082,
    "paint_mode": "rgb_mask",
    "paint_mask": "res://assets/original/ships/manta_t1/paint_mask.png",
    "details_texture": "",
    "emissive_texture": "",
    "engine_sockets": [
      {
        "id": "engine_1",
        "position": [
          -12.9,
          31.8
        ]
      },
      {
        "id": "engine_2",
        "position": [
          -0.1,
          32.1
        ]
      },
      {
        "id": "engine_3",
        "position": [
          12.8,
          31.8
        ]
      }
    ],
    "tractor_socket": [
      0,
      -28
    ],
    "collision_mode": "base_alpha"
  }
}
